{
  "$schema": "https://json-schema.org/draft/2020-12/schema",
  "$id": "https://github.com/joshualikaist/Babdoduk/schemas/magazine-edition.schema.json",
  "title": "One magazine edition: data/magazine/YYYY-MM-DD.json",
  "description": "Written by scripts/refresh_magazine.py (discovery.select.build) and cleaned by its sanitize pass, read by mukbang.html and the home page's feature. Every story is source-backed. validate_content.py adds the lane rules (trend evidence and age, dated habit stories), duplicates and the truthfulness checks; editions before rules lanes-v1 are legacy and keep fewer fields.",
  "type": "object",
  "required": ["date", "generatedAt", "featured", "lanes"],
  "additionalProperties": false,
  "properties": {
    "schemaVersion": {"type": "integer", "const": 1},
    "date": {"type": "string", "pattern": "^\\d{4}-\\d{2}-\\d{2}$"},
    "generatedAt": {"type": "string", "pattern": "^\\d{4}-\\d{2}-\\d{2}T\\d{2}:\\d{2}:\\d{2}(\\.\\d+)?[+-]\\d{2}:\\d{2}$"},
    "schedule": {
      "description": "Deprecated: the nominal schedule, never shown since 2026-10-12 (the page shows generatedAt). Older editions keep it; new ones do not write it.",
      "type": "string"
    },
    "rules": {"const": "lanes-v1"},
    "featured": {"anyOf": [{"type": "null"}, {"$ref": "#/$defs/featured"}]},
    "lanes": {
      "type": "object",
      "required": ["tips", "trend", "health", "habit"],
      "additionalProperties": false,
      "properties": {
        "tips": {"$ref": "#/$defs/lane"},
        "trend": {"$ref": "#/$defs/lane"},
        "health": {"$ref": "#/$defs/lane"},
        "habit": {"$ref": "#/$defs/lane"}
      }
    }
  },
  "$defs": {
    "lane": {
      "type": "object",
      "required": ["items"],
      "additionalProperties": false,
      "properties": {
        "lead": {"type": "string"},
        "items": {"type": "array", "maxItems": 8, "items": {"$ref": "#/$defs/story"}}
      }
    },
    "story": {
      "type": "object",
      "required": ["title", "source", "url", "medium"],
      "additionalProperties": false,
      "properties": {
        "title": {"type": "string", "minLength": 1},
        "source": {"type": "string", "minLength": 1},
        "url": {"type": "string", "pattern": "^https?://[^\\s/]+"},
        "medium": {"enum": ["blog", "youtube", "instagram", "news", "research"]},
        "summary": {"type": "string", "maxLength": 200},
        "image": {"type": "string", "pattern": "^https?://"},
        "imageSource": {"enum": ["feed_media", "feed_html", "youtube_thumbnail", "source_page_og"]},
        "publishedAt": {"type": "string", "pattern": "^\\d{4}-\\d{2}-\\d{2}"},
        "discoveredAt": {"type": "string", "pattern": "^\\d{4}-\\d{2}-\\d{2}T"},
        "sourceId": {"type": "string", "minLength": 1},
        "candidateId": {"type": "string", "pattern": "^c_[0-9a-f]{16}$"},
        "trendEvidence": {
          "type": "array",
          "minItems": 1,
          "items": {"enum": ["explicit_source_claim", "corroborated", "engagement", "sales_data"]}
        }
      }
    },
    "featured": {
      "type": "object",
      "required": ["title", "source", "url", "medium", "category"],
      "additionalProperties": false,
      "properties": {
        "title": {"type": "string", "minLength": 1},
        "source": {"type": "string", "minLength": 1},
        "url": {"type": "string", "pattern": "^https?://[^\\s/]+"},
        "medium": {"enum": ["blog", "youtube", "instagram", "news", "research"]},
        "summary": {"type": "string", "maxLength": 200},
        "image": {"type": "string", "pattern": "^https?://"},
        "imageSource": {"enum": ["feed_media", "feed_html", "youtube_thumbnail", "source_page_og"]},
        "publishedAt": {"type": "string", "pattern": "^\\d{4}-\\d{2}-\\d{2}"},
        "discoveredAt": {"type": "string", "pattern": "^\\d{4}-\\d{2}-\\d{2}T"},
        "sourceId": {"type": "string", "minLength": 1},
        "candidateId": {"type": "string", "pattern": "^c_[0-9a-f]{16}$"},
        "trendEvidence": {
          "type": "array",
          "minItems": 1,
          "items": {"enum": ["explicit_source_claim", "corroborated", "engagement", "sales_data"]}
        },
        "category": {"enum": ["tips", "trend", "health", "habit"]},
        "heroKind": {"enum": ["trend", "pick"]}
      }
    }
  }
}
