{
  "date": "2026-09-30",
  "generatedAt": "2026-10-01T00:11:15+09:00",
  "schedule": "Daily 10:00 KST",
  "rules": "lanes-v1",
  "featured": null,
  "lanes": {
    "trend": {
      "lead": "요즘 사람들이 뭘 먹고 있는지",
      "items": [
        {
          "title": "1인 외식 선택지 넓어졌다…캐치테이블, '2026 혼밥 트렌드' 공개",
          "source": "신아일보",
          "url": "https://www.shinailbo.co.kr/news/articleView.html?idxno=5063005",
          "medium": "news",
          "image": "https://cdn.shinailbo.co.kr/news/photo/202609/5063005_2060769_5238.jpg",
          "publishedAt": "2026-09-17T11:10:00+09:00",
          "discoveredAt": "2026-09-30T15:08:01+09:00",
          "sourceId": "web-exa-trend",
          "candidateId": "c_83235524224ce7f3",
          "imageSource": "source_page_og",
          "summary": "요식업 통합 솔루션 기업 와드가 운영하는 캐치테이블이 ‘2026 혼밥 트렌드 리포트’를 공개했다. 올해 혼밥 수요가 연령과 가격대, 외식 업종 전반으로 확대된 것으로 나타났다.",
          "trendEvidence": [
            "sales_data",
            "corroborated"
          ]
        },
        {
          "title": "오늘의집, ‘점심 도시락’ 트렌드…관련 검색량 최대 500% 증가",
          "source": "한국일보",
          "url": "https://daily.hankooki.com/news/articleView.html?idxno=1401767",
          "medium": "news",
          "image": "https://cdn.daily.hankooki.com/news/thumbnail/202609/1401767_1581525_432_v150.jpg",
          "publishedAt": "2026-09-02T09:51:49+09:00",
          "discoveredAt": "2026-09-30T15:08:01+09:00",
          "sourceId": "web-exa-habit",
          "candidateId": "c_98fb6f80e3a3fc3e",
          "imageSource": "source_page_og",
          "summary": "오늘의집은 고물가 영향으로 점심값을 절감하고 건강을 챙기려는 이용자들을 중심으로 도시락 관련 콘텐츠와 검색 수요가 크게 증가하고 있다고 2일 밝혔다.",
          "trendEvidence": [
            "explicit_source_claim",
            "sales_data",
            "corroborated"
          ]
        },
        {
          "title": "\"식품안전 정책·기준 마련 위한 위원회 새 구성\"",
          "source": "뉴시스 건강",
          "url": "https://www.newsis.com/view/NISX20260930_0003809262",
          "medium": "news",
          "image": "https://image.newsis.com/2026/09/30/NISI20260930_0002252272_web.jpg?rnd=20260930160956",
          "publishedAt": "2026-09-30T16:35:03+09:00",
          "discoveredAt": "2026-10-01T00:11:15+09:00",
          "sourceId": "news-newsis-health",
          "candidateId": "c_c58a42bcf45f4c99",
          "imageSource": "feed_html",
          "summary": "식품안전 분야의 주요 정책과 기준·규격 등에 대한 전문적인 논의와 자문을 위한 식품위생심의위원회가 새롭게 출범했다.",
          "trendEvidence": [
            "corroborated"
          ]
        }
      ]
    },
    "tips": {
      "lead": "밥이 더 맛있어지는 작은 조리 팁",
      "items": [
        {
          "title": "Easy Potato Recipes",
          "source": "Budget Bytes",
          "url": "https://www.budgetbytes.com/potato-recipes/",
          "medium": "blog",
          "image": "https://www.budgetbytes.com/wp-content/uploads/2023/06/Potato-Recipes-Featured.jpg",
          "publishedAt": "2026-09-26T22:30:00+09:00",
          "discoveredAt": "2026-09-29T11:19:02+09:00",
          "sourceId": "blog-budgetbytes",
          "candidateId": "c_9f2fb887826671ae",
          "imageSource": "feed_media",
          "summary": "Few ingredients can stretch a grocery budget quite like a bag of potatoes."
        },
        {
          "title": "Classic Potato Soup",
          "source": "Budget Bytes",
          "url": "https://www.budgetbytes.com/classic-potato-soup/",
          "medium": "blog",
          "image": "https://www.budgetbytes.com/wp-content/uploads/2026/09/1-Classic-Potato-Soup-Overhead-Wide.jpg",
          "publishedAt": "2026-09-23T22:30:00+09:00",
          "discoveredAt": "2026-09-29T11:19:02+09:00",
          "sourceId": "blog-budgetbytes",
          "candidateId": "c_8cb2f7af44a67691",
          "imageSource": "feed_media",
          "summary": "Some recipes just feel like home, and Classic Potato Soup is one of them for me."
        },
        {
          "title": "Salmon Fried Rice with Egg and Cabbage",
          "source": "Beyond Kimchee",
          "url": "https://www.beyondkimchee.com/salmon-fried-rice/",
          "medium": "blog",
          "image": "https://www.beyondkimchee.com/wp-content/uploads/2025/09/Salmon-fried-rice-smi.jpg",
          "publishedAt": "2026-09-13T22:03:00+09:00",
          "discoveredAt": "2026-09-29T11:19:02+09:00",
          "sourceId": "blog-beyondkimchee",
          "candidateId": "c_0e08b740b9e205ed",
          "imageSource": "source_page_og",
          "summary": "This easy salmon fried rice turns leftover rice, tender salmon, egg, and crisp cabbage into a quick one-pan meal…"
        }
      ]
    },
    "health": {
      "lead": "맛도 포기하지 않는 건강식",
      "items": [
        {
          "title": "[제440호 레시피] 오리훈제단호박볶음",
          "source": "대한급식신문",
          "url": "http://www.fsnews.co.kr/news/articleView.html?idxno=62269",
          "medium": "news",
          "image": "http://www.fsnews.co.kr/news/thumbnail/202609/62269_53114_253_v150.jpg",
          "publishedAt": "2026-09-30T03:15:52+09:00",
          "discoveredAt": "2026-09-30T15:08:01+09:00",
          "sourceId": "news-fsnews",
          "candidateId": "c_21dfa523ab024ec9",
          "imageSource": "source_page_og",
          "summary": "노란빛으로 물든 건강한 한 끼 ‘단호박’가을철 대표 채소인 단호박은 짙은 노란빛과 달콤한 맛이 특징인 식재료로 찌거나 구워 먹으며, 죽과 샐러드 등 다양한 요리에 활용된다."
        },
        {
          "title": "[제440호 레시피] 고구마그라탱",
          "source": "대한급식신문",
          "url": "http://www.fsnews.co.kr/news/articleView.html?idxno=62270",
          "medium": "news",
          "image": "http://www.fsnews.co.kr/news/thumbnail/202609/62270_53116_519_v150.jpg",
          "publishedAt": "2026-09-30T03:15:41+09:00",
          "discoveredAt": "2026-09-30T15:08:01+09:00",
          "sourceId": "news-fsnews",
          "candidateId": "c_74e6fc8db6d2ea2a",
          "imageSource": "source_page_og",
          "summary": "땅속에서 자란 영양 보물 ‘고구마’호박고구마, 밤고구마 등 전분 함량과 당도에 따라 다른 매력을 지닌 고구마는 달콤한 맛이 특징인 대표적인 구황작물로, 찌거나 구워 먹는 것은 물론 다양한 요리에 활용된다."
        },
        {
          "title": "식품안전관리인증원, 비타민Cㆍ수분ㆍ회분 분석능력 국제적 인정 받아",
          "source": "식품저널",
          "url": "http://www.foodnews.co.kr/news/articleView.html?idxno=120349",
          "medium": "news",
          "image": "https://cdn.foodnews.co.kr/news/thumbnail/202609/120349_86748_68_v150.jpg",
          "publishedAt": "2026-09-30T19:59:34+09:00",
          "discoveredAt": "2026-09-30T15:08:01+09:00",
          "sourceId": "news-foodnews",
          "candidateId": "c_b8b1619f431850a4",
          "imageSource": "source_page_og",
          "summary": "한국식품안전관리인증원(원장 한상배)은 영국 환경식품농림부 식품환경연구청(FERA)이 운영하는 국제 비교숙련도 평가(FAPAS, Food Analysis Performance Assessment Scheme)…"
        }
      ]
    },
    "habit": {
      "lead": "잘 먹는 법에 대한 작은 이야기",
      "items": [
        {
          "title": "[박성은의 리테일 읽기] 혼밥의 진화…'대충 한 끼'서 '나를 위한 미식'",
          "source": "신아일보",
          "url": "https://www.shinailbo.co.kr/news/articleView.html?idxno=5063782",
          "medium": "news",
          "image": "https://cdn.shinailbo.co.kr/news/photo/202609/5063782_2061566_4941.png",
          "publishedAt": "2026-09-21T18:00:00+09:00",
          "discoveredAt": "2026-09-30T15:08:01+09:00",
          "sourceId": "web-exa-trend",
          "candidateId": "c_a599413244f96459",
          "imageSource": "source_page_og",
          "summary": "한때 SNS(사회관계망서비스)에서 ‘혼밥 난이도 레벨’이라는 이야기가 화제가 된 바 있다. 가장 초보인 편의점에서 삼각김밥, 도시락을 먹는 것부터 시작해 패스트푸드와 국밥집, 고깃집을 거쳐 아웃백, 빕스와 같은…"
        },
        {
          "title": "체중 127㎏까지 늘었던 40대女 52kg 감량…출근 전 매일 실천한 습관은",
          "source": "코메디닷컴",
          "url": "https://kormedi.com/2874758/",
          "medium": "news",
          "image": "https://kormedi.com/wp-content/uploads/2026/09/unnamed-file-56-edited.png",
          "publishedAt": "2026-09-30T23:03:00+09:00",
          "discoveredAt": "2026-10-01T00:11:15+09:00",
          "sourceId": "news-kormedi",
          "candidateId": "c_6408d0f77374f419",
          "imageSource": "feed_media",
          "summary": "하루에 약 6000kcal를 먹을 때도 있었다는 40대 여성이 식단 조절과 하루 1만 5000보 걷기로 약 52kg을 감량했다."
        },
        {
          "title": "“허, 그 친구 대장암 4기인데”… 뭘 먹었길래?",
          "source": "코메디닷컴",
          "url": "https://kormedi.com/2875533/",
          "medium": "news",
          "image": "https://kormedi.com/wp-content/uploads/2025/10/unnamed-file-207.jpg",
          "publishedAt": "2026-09-30T14:01:00+09:00",
          "discoveredAt": "2026-09-30T15:08:01+09:00",
          "sourceId": "news-kormedi",
          "candidateId": "c_2d0378beb2cc1710",
          "imageSource": "feed_media",
          "summary": "고기 구이를 먹을 때 상추, 깻잎, 마늘 등을 곁들이면 유해 물질 배출에 도움이 된다. 사진=게티이미지뱅크 대장암 환자가 크게 늘고 있다."
        },
        {
          "title": "「한국인은 왜 이렇게 먹을까?」 식사 방식으로 본 한국 음식문화사",
          "source": "webzine.nfm.go.kr",
          "url": "https://webzine.nfm.go.kr/2025/08/27/%EC%8B%9D%EC%82%AC-%EB%B0%A9%EC%8B%9D%EC%9C%BC%EB%A1%9C-%EB%B3%B8-%ED%95%9C%EA%B5%AD-%EC%9D%8C%EC%8B%9D%EB%AC%B8%ED%99%94%EC%82%AC/",
          "medium": "research",
          "image": "https://webzine.nfm.go.kr/wp-content/uploads/2026/01/cropped-cropped-nfm_2026_black.png",
          "publishedAt": "2025-08-27T09:00:00+09:00",
          "discoveredAt": "2026-09-30T15:08:01+09:00",
          "sourceId": "web-exa-habit",
          "candidateId": "c_f19f1e5ea949f376",
          "imageSource": "source_page_og",
          "summary": "한국인의 밥상은 서양은 물론이고 이웃 나라인 중국이나 일본과도 확연히 다르다. 음식과 식사 도구도 다르고, 식사 예절도 다르다."
        }
      ]
    }
  }
}
