{
  "date": "2026-09-17",
  "generatedAt": "2026-09-17T10:00:00+09:00",
  "schedule": "Daily 10:00 KST",
  "featured": null,
  "lanes": {
    "tips": {
      "lead": "밥이 더 맛있어지는 작은 조리 팁",
      "items": [
        {
          "title": "Jatjuk (Pine Nut Porridge)",
          "source": "Korean Bapsang",
          "url": "https://www.koreanbapsang.com/jatjuk-pine-nut-porridge/",
          "medium": "blog"
        },
        {
          "title": "콩나물국 끓이는 법 캬~시원하다! 개운하고 깔끔한 초간단 콩나물국",
          "source": "엄마표 집밥",
          "url": "https://irisblossomlife.tistory.com/160",
          "medium": "blog"
        },
        {
          "title": "Kkakdugi (Cubed Radish Kimchi)",
          "source": "Korean Bapsang",
          "url": "https://www.koreanbapsang.com/kkakdugi-cubed-radish-kimchi/",
          "medium": "blog"
        }
      ]
    },
    "trend": {
      "lead": "요즘 사람들이 뭘 먹고 있는지",
      "items": []
    },
    "health": {
      "lead": "맛도 포기하지 않는 건강식",
      "items": [
        {
          "title": "Makgeolli (Korean Rice Wine)",
          "source": "My Korean Kitchen",
          "url": "https://mykoreankitchen.com/makgeolli/",
          "medium": "blog"
        },
        {
          "title": "20 Korean Vegan Recipes",
          "source": "Korean Bapsang",
          "url": "https://www.koreanbapsang.com/15-korean-vegan-recipes/",
          "medium": "blog"
        },
        {
          "title": "Dakjuk (Korean Chicken Porridge)",
          "source": "My Korean Kitchen",
          "url": "https://mykoreankitchen.com/dakjuk-korean-chicken-porridge/",
          "medium": "blog"
        }
      ]
    },
    "habit": {
      "lead": "잘 먹는 법에 대한 작은 이야기",
      "items": []
    }
  }
}
