{
  "date": "2026-09-12",
  "generatedAt": "2026-09-12T10:00:00+09:00",
  "schedule": "Daily 10:00 KST",
  "featured": null,
  "lanes": {
    "tips": {
      "lead": "밥이 더 맛있어지는 작은 조리 팁",
      "items": [
        {
          "title": "김치수제비 만들기 반죽은 쫄깃쫄깃 국물은 얼큰 시원한 맛있는 김치수제비 - 신김치 요리 9 탄",
          "source": "엄마표 집밥",
          "url": "https://irisblossomlife.tistory.com/176",
          "medium": "blog"
        },
        {
          "title": "20 Korean Vegan Recipes",
          "source": "Korean Bapsang",
          "url": "https://www.koreanbapsang.com/15-korean-vegan-recipes/",
          "medium": "blog"
        }
      ]
    },
    "trend": {
      "lead": "요즘 사람들이 뭘 먹고 있는지",
      "items": []
    },
    "health": {
      "lead": "맛도 포기하지 않는 건강식",
      "items": [
        {
          "title": "LA Galbi (Korean BBQ Short Ribs)",
          "source": "Korean Bapsang",
          "url": "https://www.koreanbapsang.com/la-galbi-gui-grilled-la-style-short-ribs/",
          "medium": "blog"
        },
        {
          "title": "Makgeolli (Korean Rice Wine)",
          "source": "My Korean Kitchen",
          "url": "https://mykoreankitchen.com/makgeolli/",
          "medium": "blog"
        },
        {
          "title": "20 Korean Vegan Recipes",
          "source": "Korean Bapsang",
          "url": "https://www.koreanbapsang.com/15-korean-vegan-recipes/",
          "medium": "blog"
        }
      ]
    },
    "habit": {
      "lead": "잘 먹는 법에 대한 작은 이야기",
      "items": []
    }
  }
}
