{
  "date": "2026-09-13",
  "generatedAt": "2026-09-13T10:00:00+09:00",
  "schedule": "Daily 10:00 KST",
  "featured": null,
  "lanes": {
    "tips": {
      "lead": "밥이 더 맛있어지는 작은 조리 팁",
      "items": [
        {
          "title": "Kkakdugi (Cubed Radish Kimchi)",
          "source": "Korean Bapsang",
          "url": "https://www.koreanbapsang.com/kkakdugi-cubed-radish-kimchi/",
          "medium": "blog"
        },
        {
          "title": "돈가스 만드는 법 바삭바삭 육즙 가득한 호불호 없는 수제 경양식 돈가스",
          "source": "엄마표 집밥",
          "url": "https://irisblossomlife.tistory.com/154",
          "medium": "blog"
        },
        {
          "title": "Sundubu Gyeran Guk (Soft Tofu and Egg Soup)",
          "source": "Korean Bapsang",
          "url": "https://www.koreanbapsang.com/sundubu-gyeran-guk-soft-tofu-and-egg-soup/",
          "medium": "blog"
        }
      ]
    },
    "trend": {
      "lead": "요즘 사람들이 뭘 먹고 있는지",
      "items": []
    },
    "health": {
      "lead": "맛도 포기하지 않는 건강식",
      "items": [
        {
          "title": "15 Spring Vegetable Recipes",
          "source": "Korean Bapsang",
          "url": "https://www.koreanbapsang.com/spring-vegetable-recipes/",
          "medium": "blog"
        },
        {
          "title": "Butter Tteok (Butter Rice Cake) – Golden Crust, Chewy Center",
          "source": "My Korean Kitchen",
          "url": "https://mykoreankitchen.com/butter-tteok/",
          "medium": "blog"
        },
        {
          "title": "Jatjuk (Pine Nut Porridge)",
          "source": "Korean Bapsang",
          "url": "https://www.koreanbapsang.com/jatjuk-pine-nut-porridge/",
          "medium": "blog"
        }
      ]
    },
    "habit": {
      "lead": "잘 먹는 법에 대한 작은 이야기",
      "items": []
    }
  }
}
