{
  "date": "2026-09-24",
  "generatedAt": "2026-09-24T10:00:00+09:00",
  "schedule": "Daily 10:00 KST",
  "featured": null,
  "lanes": {
    "trend": {
      "lead": "요즘 사람들이 뭘 먹고 있는지",
      "items": []
    },
    "tips": {
      "lead": "밥이 더 맛있어지는 작은 조리 팁",
      "items": [
        {
          "title": "꼬막비빔밥 만들기 10분 완성 탱글쫄깃 꼬막과 새콤달콤한 양념장에 밥 비벼먹기 좋은 꼬막비빔밥",
          "source": "엄마표 집밥",
          "url": "https://irisblossomlife.tistory.com/168",
          "medium": "blog"
        },
        {
          "title": "Jatjuk (Pine Nut Porridge)",
          "source": "Korean Bapsang",
          "url": "https://www.koreanbapsang.com/jatjuk-pine-nut-porridge/",
          "medium": "blog"
        },
        {
          "title": "LA Galbi (Korean BBQ Short Ribs)",
          "source": "Korean Bapsang",
          "url": "https://www.koreanbapsang.com/la-galbi-gui-grilled-la-style-short-ribs/",
          "medium": "blog"
        }
      ]
    },
    "health": {
      "lead": "맛도 포기하지 않는 건강식",
      "items": [
        {
          "title": "Bok Choy Kimchi (Quick & Easy)",
          "source": "My Korean Kitchen",
          "url": "https://mykoreankitchen.com/bok-choy-kimchi/",
          "medium": "blog"
        }
      ]
    },
    "habit": {
      "lead": "잘 먹는 법에 대한 작은 이야기",
      "items": []
    }
  }
}
