{
  "date": "2026-09-27",
  "generatedAt": "2026-09-27T10:00:00+09:00",
  "schedule": "Daily 10:00 KST",
  "featured": {
    "title": "20 Korean Vegan Recipes",
    "source": "Korean Bapsang",
    "url": "https://www.koreanbapsang.com/15-korean-vegan-recipes/",
    "medium": "blog",
    "category": "tips"
  },
  "lanes": {
    "trend": {
      "lead": "요즘 사람들이 뭘 먹고 있는지",
      "items": []
    },
    "tips": {
      "lead": "밥이 더 맛있어지는 작은 조리 팁",
      "items": [
        {
          "title": "김치김밥 만들기 신전 치즈김밥에 참치가 쏙?! 매콤부드러운 치즈참치김밥 - 신김치 요리 12 탄",
          "source": "엄마표 집밥",
          "url": "https://irisblossomlife.tistory.com/194",
          "medium": "blog"
        },
        {
          "title": "LA Galbi (Korean BBQ Short Ribs)",
          "source": "Korean Bapsang",
          "url": "https://www.koreanbapsang.com/la-galbi-gui-grilled-la-style-short-ribs/",
          "medium": "blog"
        }
      ]
    },
    "health": {
      "lead": "맛도 포기하지 않는 건강식",
      "items": [
        {
          "title": "Donggeurangttaeng (Korean Meat Patties)",
          "source": "My Korean Kitchen",
          "url": "https://mykoreankitchen.com/korean-meat-patties/",
          "medium": "blog"
        }
      ]
    },
    "habit": {
      "lead": "잘 먹는 법에 대한 작은 이야기",
      "items": []
    }
  }
}
