{
  "date": "2026-10-12",
  "generatedAt": "2026-10-12T15:44:20+09:00",
  "schedule": "Daily 10:00 KST",
  "rules": "lanes-v1",
  "featured": {
    "title": "비비고 오마이갓 미니약과 오리지널 유자맛 칼로리, 가격, 솔직후기",
    "source": "달순생활",
    "url": "https://dalsoonlife.tistory.com/241",
    "medium": "blog",
    "image": "https://blog.kakaocdn.net/dn/nP7kf/dJMcaf9iq0n/i2TZgqWBhJlCS0h8Jkjnek/tfile.jpg",
    "category": "trend",
    "publishedAt": "2026-10-08T19:37:56+09:00",
    "discoveredAt": "2026-10-12T15:44:20+09:00",
    "sourceId": "blog-dalsoonlife",
    "candidateId": "c_180d088d47126d62",
    "imageSource": "feed_html",
    "summary": "최근 약과 열풍이 식지 않고 계속되면서 마트나 편의점, 올리브영 디저트 코너에서도 정말 다양한 K–디저트 간식들이 눈에 띄는데요.",
    "heroKind": "trend",
    "trendEvidence": [
      "explicit_source_claim",
      "corroborated"
    ]
  },
  "lanes": {
    "trend": {
      "lead": "요즘 사람들이 뭘 먹고 있는지",
      "items": [
        {
          "title": "GS25, 로로멜로와 ‘한정선 찹쌀떡’ 2탄 출시…‘떡지순례 열풍 이어간다’",
          "source": "선데이타임즈",
          "url": "https://sundaytimes.kr/View.aspx?No=4252513",
          "medium": "blog",
          "image": "https://cdn.coenworks.com/Files/12/News/202610/1681_20261006074651058_w.jpg",
          "publishedAt": "2026-10-06T08:02:20+09:00",
          "discoveredAt": "2026-10-11T15:36:58+09:00",
          "sourceId": "web-exa-trend",
          "candidateId": "c_d21becf7c023cd6c",
          "imageSource": "source_page_og",
          "summary": "GS리테일이 운영하는 편의점 GS25가 디저트 브랜드 ‘로로멜로’와 함께 ‘한정선 피스타치오 찹쌀떡’을 출시한다.",
          "trendEvidence": [
            "explicit_source_claim",
            "sales_data"
          ]
        },
        {
          "title": "“50kg 뺐다”… 결혼 후 살 뺀 20대 여성, 아침에 먹은 음식은?",
          "source": "헬스조선",
          "url": "https://health.chosun.com/site/data/html_dir/2026/10/08/2026100802977.html",
          "medium": "news",
          "publishedAt": "2026-10-12T00:01:00+09:00",
          "discoveredAt": "2026-10-12T15:44:20+09:00",
          "sourceId": "news-healthchosun",
          "candidateId": "c_fd25966940f67594",
          "summary": "",
          "trendEvidence": [
            "corroborated"
          ]
        },
        {
          "title": "“치매 오기 전 식단부터 바꿨더니”⋯12주 만에 노인에게 찾아온 효과",
          "source": "코메디닷컴",
          "url": "https://kormedi.com/2882581/",
          "medium": "news",
          "publishedAt": "2026-10-12T14:46:44+09:00",
          "discoveredAt": "2026-10-12T15:44:20+09:00",
          "sourceId": "news-kormedi",
          "candidateId": "c_34924e2c4cd9e3ce",
          "summary": "고혈압 식단과 지중해식 식단을 결합한 마인드 식단이 치매 전 단계인 경도인지장애 노인의 인지기능 개선에 도움을 준다는 연구 결과가 나왔다.",
          "trendEvidence": [
            "corroborated"
          ]
        }
      ]
    },
    "tips": {
      "lead": "밥이 더 맛있어지는 작은 조리 팁",
      "items": [
        {
          "title": "일본식 카레 만들기｜고형카레로 만드는 진한 일본식 카레 레시피",
          "source": "기록하는 인간 (요리)",
          "url": "https://cultureagora.tistory.com/378",
          "medium": "blog",
          "image": "https://blog.kakaocdn.net/dn/7BnQA/dJMcafPjxC6/pnS3M9kDGUUx3l0rbplJvK/tfile.png",
          "publishedAt": "2026-10-12T08:00:10+09:00",
          "discoveredAt": "2026-10-12T15:44:20+09:00",
          "sourceId": "blog-cultureagora",
          "candidateId": "c_96832714bc523b28",
          "imageSource": "feed_html",
          "summary": "일본식 카레는 재료도 익숙하고 만드는 방법도 어렵지 않아 집에서 자주 해먹기 좋은 메뉴입니다. 감자와 당근, 가지, 양파, 고기를 큼직하게 넣고 끓인 뒤 고형카레를 풀어주면 기본적인 카레는 완성됩니다."
        },
        {
          "title": "양배추 계란볶음 만들기｜당뇨 식단에 좋은 담백한 저염 반찬 레시피",
          "source": "기록하는 인간 (요리)",
          "url": "https://cultureagora.tistory.com/377",
          "medium": "blog",
          "image": "https://blog.kakaocdn.net/dn/lEzUz/dJMcadRgwyy/6jDkSu98mdtjKV39GHefwk/tfile.png",
          "publishedAt": "2026-10-11T17:50:54+09:00",
          "discoveredAt": "2026-10-12T15:44:20+09:00",
          "sourceId": "blog-cultureagora",
          "candidateId": "c_6d481926a25c7600",
          "imageSource": "feed_html",
          "summary": "양배추와 달걀만 있으면 누구나 간단하게 만들 수 있는 요리가 있습니다. 바로 양배추 계란볶음 입니다. 아삭하면서도 달큰한 양배추에 부드럽고 고소한 달걀을 더하면 특별한 양념 없이도 맛있는 반찬이 완성됩니다."
        },
        {
          "title": "애호박채전 절이지 않고 10분 만에 만드는 초간단 애호박계란전 레시피",
          "source": "달순생활",
          "url": "https://dalsoonlife.tistory.com/242",
          "medium": "blog",
          "image": "https://blog.kakaocdn.net/dn/bxZwEK/dJMcacEWkAU/d9SNZQEdhZcOWzFGuuVIlk/tfile.jpg",
          "publishedAt": "2026-10-09T15:57:16+09:00",
          "discoveredAt": "2026-10-12T15:44:20+09:00",
          "sourceId": "blog-dalsoonlife",
          "candidateId": "c_a39cdddd0d601b1d",
          "imageSource": "feed_html",
          "summary": "애호박을 소금에 절이지 않고 계란물에 바로 섞어 부쳐내면, 애호박 특유의 아삭한 식감과 달큰한 즙이 그대로 살아있어 훨씬 촉촉하고 담백한 애호박채전을 만들 수 있어요."
        },
        {
          "title": "신상출시 편스토랑 도경완의 새송이반반치킨 새송이치킨 새송이양념치킨 만드는 법",
          "source": "알고 보면 (방송 레시피)",
          "url": "https://seon1982.tistory.com/4118",
          "medium": "blog",
          "image": "https://blog.kakaocdn.net/dn/cP1PVM/dJMcaiZfV2o/LY4il3qL8qq0PynQsMpKSk/img.png",
          "publishedAt": "2026-10-09T00:00:20+09:00",
          "discoveredAt": "2026-10-12T15:44:20+09:00",
          "sourceId": "blog-seon1982",
          "candidateId": "c_463c7164f7b6dac2",
          "imageSource": "feed_html",
          "summary": "340회 신상출시 편스토랑에서 도경완은 저당 안주 레시피로 새송이버섯을 활용해 15분 안에 치킨 만드는 법을 공개했는데요. 방송에 소개된 새송이 반반치킨 레시피를 올려봅니다."
        },
        {
          "title": "알토란 배우 양희경의 꼬시래기무침 꼬시래기버섯무침 만드는 법",
          "source": "알고 보면 (방송 레시피)",
          "url": "https://seon1982.tistory.com/4122",
          "medium": "blog",
          "image": "https://blog.kakaocdn.net/dn/bGiuKL/dJMcacrvtYD/iseBKNTcQEIGktAIyAKdr1/img.png",
          "publishedAt": "2026-10-12T00:00:52+09:00",
          "discoveredAt": "2026-10-12T15:44:20+09:00",
          "sourceId": "blog-seon1982",
          "candidateId": "c_80c4a19e3a0cc834",
          "imageSource": "feed_html",
          "summary": "알토란 614회에서는 반찬 백화점 한 상 편이 방송되었습니다. 배우 양희경은 속 편한 별미 반찬으로 식감과 맛을 모두 잡고 샐러드처럼 만들어 먹기 좋은 꼬시래기버섯무침 만드는 법을 알려주셨는데요."
        }
      ]
    },
    "health": {
      "lead": "맛도 포기하지 않는 건강식",
      "items": [
        {
          "title": "“상추보다 많다”… 비타민K 풍부한 식품 5가지",
          "source": "하이닥 헬시라이프",
          "url": "https://news.hidoc.co.kr/news/articleView.html?idxno=68387",
          "medium": "news",
          "publishedAt": "2026-10-07T17:00:00+09:00",
          "discoveredAt": "2026-10-12T15:44:20+09:00",
          "sourceId": "news-hidoc-healthylife",
          "candidateId": "c_e875c5b80c9169c8",
          "summary": "상추는 고기를 구워 먹을 때 빠지지 않는 대표 쌈 채소다. 비빔밥이나 겉절이 재료로도 두루 쓰이며, 더위에 약해 선선한 요즘 같은 가을에 수확이 이어진다."
        },
        {
          "title": "“한 달간 고기·물·소금만 먹었다”… 연구자 몸에 나타난 ‘뜻밖의 변화’",
          "source": "헬스조선",
          "url": "https://health.chosun.com/site/data/html_dir/2026/10/08/2026100801968.html",
          "medium": "news",
          "publishedAt": "2026-10-11T10:00:00+09:00",
          "discoveredAt": "2026-10-12T15:44:20+09:00",
          "sourceId": "news-healthchosun",
          "candidateId": "c_7bb34148586cfb41",
          "summary": ""
        },
        {
          "title": "\"키위 먹고 변비 좋아졌다?\"... 연구로 살펴본 뜻밖의 키위 효능 4가지",
          "source": "하이닥 헬시라이프",
          "url": "https://news.hidoc.co.kr/news/articleView.html?idxno=68430",
          "medium": "news",
          "publishedAt": "2026-10-11T05:00:00+09:00",
          "discoveredAt": "2026-10-12T15:44:20+09:00",
          "sourceId": "news-hidoc-healthylife",
          "candidateId": "c_5cb036ebe94c7bd7",
          "summary": "키위는 비타민C와 식이섬유, 칼륨 등을 함께 섭취할 수 있는 과일이다. 미국 매체 '메디컬뉴스투데이'가 미국 농무부(USDA) 식품성분 자료를 인용해 소개한 내용에 따르면, 껍질을 벗긴 키위 100g에는 비타민C…"
        }
      ]
    },
    "habit": {
      "lead": "잘 먹는 법에 대한 작은 이야기",
      "items": [
        {
          "title": "미국 통조림 시장 1000억 달러 전망…‘저가 비상식’서 건강·편의식으로",
          "source": "식품음료신문",
          "url": "https://www.thinkfood.co.kr/news/articleView.html?idxno=201343",
          "medium": "news",
          "image": "https://cdn.thinkfood.co.kr/news/photo/202610/201343_201909_1857.jpg",
          "publishedAt": "2026-10-12T16:50:00+09:00",
          "discoveredAt": "2026-10-12T15:44:20+09:00",
          "sourceId": "news-thinkfood",
          "candidateId": "c_17e3f2df24dba1e5",
          "imageSource": "source_page_og",
          "summary": "미국 통조림 식품 시장이 장기보관이 가능한 저가 식품이라는 기존 이미지를 벗고 건강과 영양, 편의성을 강조한 간편식 시장으로 영역을 넓히고 있다."
        },
        {
          "title": "\"과일 먹을 때 이것만은 피하라\"…과일 먹을 때 따져볼 것",
          "source": "뉴시스",
          "url": "https://www.newsis.com/view/NISX20261011_0003820956",
          "medium": "news",
          "image": "https://image.newsis.com/2026/10/11/NISI20261011_0002260075_web.jpg?rnd=20261011134042",
          "publishedAt": "2026-10-11T17:49:00+09:00",
          "discoveredAt": "2026-10-12T15:44:20+09:00",
          "sourceId": "news-newsis-health",
          "candidateId": "c_7d14c235b9f4ec27",
          "imageSource": "feed_html",
          "summary": "허준희 인턴 기자 = 과일은 식사 후 디저트로 먹거나 갈아서 주스로 마시는 경우가 많지만, 과일의 영양소를 충분히 섭취하려면 생과일을 그대로 씹어 먹는 것이 좋다는 전문가의 조언이 나왔다."
        },
        {
          "title": "‘혼밥’과 ‘함께 식사’ 중, 혈당 덜 올리는 것은?",
          "source": "헬스조선",
          "url": "https://health.chosun.com/site/data/html_dir/2026/10/12/2026101201543.html",
          "medium": "news",
          "publishedAt": "2026-10-12T14:38:06+09:00",
          "discoveredAt": "2026-10-12T15:44:20+09:00",
          "sourceId": "news-healthchosun",
          "candidateId": "c_b91e75442c8795b5",
          "summary": ""
        }
      ]
    }
  }
}
