{
  "date": "2026-10-11",
  "generatedAt": "2026-10-11T15:36:58+09:00",
  "schedule": "Daily 10:00 KST",
  "rules": "lanes-v1",
  "featured": {
    "title": "日 생초코파이 100만개 팔리자 2탄까지…편의점 냉장고에 무슨 일이",
    "summary": "편의점 디저트 경쟁이 빵과 케이크를 넘어 냉장·냉동 상품으로 빠르게 확산하고 있다. 일본 현지 인기 상품을 직접 들여오거나 유명 디저트 브랜드와 손잡는 방식으로 다른 편의점에서는 살 수 없는 상품을 확보하려는…",
    "source": "세계일보",
    "sourceId": "web-exa-trend",
    "candidateId": "c_e3915bda852e1a31",
    "url": "https://www.segye.com/newsView/20261011503277",
    "medium": "news",
    "discoveredAt": "2026-10-11T15:36:58+09:00",
    "publishedAt": "2026-10-11T07:40:00+09:00",
    "image": "https://www.segye.com/content/image/2026/10/11/20261011503278.jpg",
    "imageSource": "source_page_og",
    "trendEvidence": [
      "explicit_source_claim",
      "sales_data"
    ],
    "category": "trend",
    "heroKind": "trend"
  },
  "lanes": {
    "trend": {
      "lead": "요즘 사람들이 뭘 먹고 있는지",
      "items": [
        {
          "title": "두쫀쿠·버터떡 이어 피자설기까지…피자헛도 뛰어든 ‘디저트 유행’[똑똑! 스마슈머]",
          "summary": "두바이 쫀득 쿠키와 버터떡에 이어 최근 사회관계망서비스(SNS)에서 인기를 끌고 있는 ‘피자설기’가 프랜차이즈 매장에도 등장했다.",
          "source": "서울경제",
          "sourceId": "web-exa-trend",
          "candidateId": "c_c9cc89ce4e204148",
          "url": "https://www.sedaily.com/article/20099695",
          "medium": "news",
          "discoveredAt": "2026-10-11T15:36:58+09:00",
          "publishedAt": "2026-10-10T10:00:00+09:00",
          "image": "https://wimg.sedaily.com/news/cms/2026/10/08/news-p.v1.20261008.a5f93f3b965e492db6245e0a23615850_Z1.jpg",
          "imageSource": "source_page_og",
          "trendEvidence": [
            "explicit_source_claim",
            "sales_data"
          ]
        },
        {
          "title": "[트렌드 포커스] 1인 가구 증가에 판 커진 간편식 시장…차별화된 맛과 기술력으로 승부",
          "summary": "집에서 혼자 간편하게 즐길 수 있는 간편식 제품이 빠르게 성장하고 있는 것. 다만 다른 점이 있다면 과거에는 바쁜 일상에서 끼니를 해결하기 위한 대체식에 가까웠다면 최근에는 맛과 영양, 편의성까지 고려한 하나의…",
          "source": "시사캐스트",
          "sourceId": "web-exa-trend",
          "candidateId": "c_e64820c7dd003bfd",
          "url": "http://www.sisacast.kr/news/articleView.html?idxno=100866",
          "medium": "news",
          "discoveredAt": "2026-10-11T15:36:58+09:00",
          "publishedAt": "2026-10-09T19:10:54+09:00",
          "image": "http://www.sisacast.kr/news/thumbnail/202610/100866_109805_4321_v150.jpg",
          "imageSource": "source_page_og",
          "trendEvidence": [
            "explicit_source_claim",
            "sales_data"
          ]
        },
        {
          "title": "GS25, 70만개 팔린 한정선 찹쌀떡 2탄 출시... 이번엔 피스타치오",
          "summary": "GS25가 올 하반기 '떡지순례' 열풍의 주역으로 떠오른 '한정선 요거트 찹쌀떡' 인기에 힘입어 후속 제품을 출시했다. 해당 제품은 누적 판매량 70만개를 기록하며 품절 대란을 일으킬만큼 인기가 많았다.",
          "source": "인사이트",
          "sourceId": "web-exa-trend",
          "candidateId": "c_792e7108ab270831",
          "url": "https://web.insight.co.kr/news/576568",
          "medium": "news",
          "discoveredAt": "2026-10-11T15:36:58+09:00",
          "publishedAt": "2026-10-06T18:40:00+09:00",
          "image": "https://img.insight.co.kr/static/2026/10/06/1200/img_20261006091429_25x7819l.jpg",
          "imageSource": "source_page_og",
          "trendEvidence": [
            "explicit_source_claim",
            "sales_data"
          ]
        },
        {
          "title": "“20대 아니여도 돼?” 韓대표 무려 91년생 35살…이혼도 결혼도 ‘다 괜찮다’는 미인대회[이슈픽]",
          "summary": "만 35세 여성이 세계 최고 권위의 미인대회인 미스유니버스에 한국 대표로 참가한다. 7일 미스유니버스 코리아 등에 따르면 오는 11월 카리브해 미국령 푸에르토리코에서 열리는 제75회 미스유니버스 세계대회에 한국…",
          "source": "서울신문 라이프",
          "sourceId": "news-seoul-life",
          "candidateId": "c_77c4693ef98b287a",
          "url": "https://www.seoul.co.kr/news/newsView.php?id=20261008500109",
          "medium": "news",
          "discoveredAt": "2026-10-08T15:48:07+09:00",
          "publishedAt": "2026-10-08T13:20:05+09:00",
          "trendEvidence": [
            "corroborated"
          ]
        },
        {
          "title": "2026년 10월 9일 신상 식품 소식",
          "summary": "GS25 여주 고구마 샐러드, CU 초성 마카롱, 브레드앤버터 한글 패키지 등 편의점·외식·간편식 신규 소식 20건을 정리했습니다.",
          "source": "오늘의 신상 식품",
          "sourceId": "web-exa-trend",
          "candidateId": "c_6435433d907e5578",
          "url": "https://food.mingky.me/news/2026-10-09-new-food/",
          "medium": "blog",
          "discoveredAt": "2026-10-11T15:36:58+09:00",
          "publishedAt": "2026-10-09T09:00:00+09:00",
          "trendEvidence": [
            "explicit_source_claim"
          ]
        },
        {
          "title": "\"K-건강빵도 해외로\" 파리바게뜨, '파란라벨' 싱가포르 전 매장 확대",
          "summary": "파리바게뜨가 건강 베이커리 브랜드 '파란라벨'의 판매를 싱가포르 전 매장으로 확대하며 글로벌 시장 공략에 나선다고 7일 밝혔다.",
          "source": "뉴시스 건강",
          "sourceId": "news-newsis-health",
          "candidateId": "c_be9073786411fd5f",
          "url": "https://www.newsis.com/view/NISX20261007_0003816866",
          "medium": "news",
          "discoveredAt": "2026-10-07T15:40:53+09:00",
          "publishedAt": "2026-10-07T09:59:15+09:00",
          "trendEvidence": [
            "sales_data"
          ]
        }
      ]
    },
    "tips": {
      "lead": "밥이 더 맛있어지는 작은 조리 팁",
      "items": [
        {
          "title": "Best Pumpkin Recipes",
          "summary": "I LOVE October. Pumpkins, costumes, cider, the smell of fallen leaves, and lots and lots of candy…what’s not to love?",
          "source": "Budget Bytes",
          "sourceId": "blog-budgetbytes",
          "candidateId": "c_d38ca82c61a457fa",
          "url": "https://www.budgetbytes.com/pumpkin-recipes/",
          "medium": "blog",
          "discoveredAt": "2026-10-11T15:36:58+09:00",
          "publishedAt": "2026-10-10T22:30:00+09:00",
          "image": "https://www.budgetbytes.com/wp-content/uploads/2022/10/Pumpkin-Recipes-Collage.jpg",
          "imageSource": "feed_media"
        }
      ]
    },
    "health": {
      "lead": "맛도 포기하지 않는 건강식",
      "items": []
    },
    "habit": {
      "lead": "잘 먹는 법에 대한 작은 이야기",
      "items": [
        {
          "title": "‘30kg 감량’ 이수현 “일본 편의점에서 식단 해결”⋯뭐 먹었을까?",
          "summary": "다이어트에 성공한 이수현은 일본 출장 중 편의점 음식으로 식단을 관리했다. 남매 듀오 악뮤(AKMU) 이수현이 30kg 감량 후에도 체중 관리를 이어갔다.",
          "source": "코메디닷컴",
          "sourceId": "news-kormedi",
          "candidateId": "c_97b547e25e2a2d29",
          "url": "https://kormedi.com/2880125/",
          "medium": "news",
          "discoveredAt": "2026-10-11T15:36:58+09:00",
          "publishedAt": "2026-10-11T15:03:00+09:00"
        },
        {
          "title": "68세 주병진 “살찐다 싶으면 ‘이것’만 먹고 잔다”⋯변함없는 체형 비결은?",
          "summary": "주병진은 몸이 무거워졌다고 느끼는 날에는 저녁까지 달걀만 먹고 잠자리에 든다고 밝혔다. 사진=tvN STORY ‘남겨서 뭐하게’ 방송인 주병진이 오래전 입던 양복을 지금도 입을 수 있는 체형 관리법을 공개했다.",
          "source": "코메디닷컴",
          "sourceId": "news-kormedi",
          "candidateId": "c_fd217976efead36f",
          "url": "https://kormedi.com/2879474/",
          "medium": "news",
          "discoveredAt": "2026-10-11T15:36:58+09:00",
          "publishedAt": "2026-10-11T13:04:00+09:00"
        },
        {
          "title": "건강 챙기는 소비자 늘자…편의점 간편식도 ‘저당·고단백’",
          "summary": "1인 가구 증가와 고물가로 편의점 간편식으로 한 끼를 해결하는 소비자가 늘고 있는 가운데 편의점업계의 간편식 경쟁이 치열하다.",
          "source": "이코노믹리뷰",
          "sourceId": "web-exa-trend",
          "candidateId": "c_b5e43f029f760861",
          "url": "https://www.econovill.com/news/articleView.html?idxno=746695",
          "medium": "news",
          "discoveredAt": "2026-10-11T15:36:58+09:00",
          "publishedAt": "2026-07-31T08:48:42+09:00"
        }
      ]
    }
  }
}
