{
  "date": "2026-09-20",
  "generatedAt": "2026-09-20T10:00:00+09:00",
  "schedule": "Daily 10:00 KST",
  "featured": {
    "title": "Kimbap (Seaweed Rice Rolls)",
    "source": "Korean Bapsang",
    "url": "https://www.koreanbapsang.com/gimbapkimbap-korean-dried-seaweed-rolls/",
    "medium": "blog",
    "category": "tips"
  },
  "lanes": {
    "trend": {
      "lead": "요즘 사람들이 뭘 먹고 있는지",
      "items": [
        {
          "title": "라면으로 만들어도 진짜 맛있습니다.",
          "source": "자취요리신",
          "url": "https://www.youtube.com/shorts/BUWNpy7w2-4",
          "medium": "youtube",
          "image": "https://i.ytimg.com/vi/BUWNpy7w2-4/maxresdefault.jpg"
        },
        {
          "title": "Jatjuk (Pine Nut Porridge)",
          "source": "Korean Bapsang",
          "url": "https://www.koreanbapsang.com/jatjuk-pine-nut-porridge/",
          "medium": "blog"
        },
        {
          "title": "돼지불고기 레시피 15분 완성! 고기를 재워놓아서 야들야들 부드럽고 촉촉한 돼지불고기 - 신김치 요리 10 탄",
          "source": "엄마표 집밥",
          "url": "https://irisblossomlife.tistory.com/182",
          "medium": "blog"
        }
      ]
    },
    "tips": {
      "lead": "밥이 더 맛있어지는 작은 조리 팁",
      "items": [
        {
          "title": "동그랑땡 레시피 초보자도 쉽게! 초간단 업그레이된 밀가루없이 육즙 가득 촉촉 부드러운 동그랑땡 만들기",
          "source": "엄마표 집밥",
          "url": "https://irisblossomlife.tistory.com/163",
          "medium": "blog"
        },
        {
          "title": "Makgeolli (Korean Rice Wine)",
          "source": "My Korean Kitchen",
          "url": "https://mykoreankitchen.com/makgeolli/",
          "medium": "blog"
        }
      ]
    },
    "health": {
      "lead": "맛도 포기하지 않는 건강식",
      "items": [
        {
          "title": "Bok Choy Kimchi (Quick & Easy)",
          "source": "My Korean Kitchen",
          "url": "https://mykoreankitchen.com/bok-choy-kimchi/",
          "medium": "blog"
        }
      ]
    },
    "habit": {
      "lead": "잘 먹는 법에 대한 작은 이야기",
      "items": []
    }
  }
}
