{
  "date": "2026-09-22",
  "generatedAt": "2026-09-22T10:00:00+09:00",
  "schedule": "Daily 10:00 KST",
  "featured": {
    "title": "Kkakdugi (Cubed Radish Kimchi)",
    "source": "Korean Bapsang",
    "url": "https://www.koreanbapsang.com/kkakdugi-cubed-radish-kimchi/",
    "medium": "blog",
    "category": "tips"
  },
  "lanes": {
    "trend": {
      "lead": "요즘 사람들이 뭘 먹고 있는지",
      "items": [
        {
          "title": "명란비빔밥 만드는 법 고소한 들기름에 부드러운 명란젓의 환상 조합! 밥도둑 명란부추비빔밥",
          "source": "엄마표 집밥",
          "url": "https://irisblossomlife.tistory.com/169",
          "medium": "blog"
        },
        {
          "title": "Jatjuk (Pine Nut Porridge)",
          "source": "Korean Bapsang",
          "url": "https://www.koreanbapsang.com/jatjuk-pine-nut-porridge/",
          "medium": "blog"
        }
      ]
    },
    "tips": {
      "lead": "밥이 더 맛있어지는 작은 조리 팁",
      "items": [
        {
          "title": "육개장 만드는 법 숙취해소로 제격! 얼큰 매콤 깔끔 시원한 전통 육개장",
          "source": "엄마표 집밥",
          "url": "https://irisblossomlife.tistory.com/172",
          "medium": "blog"
        },
        {
          "title": "Baechujeon (Korean Cabbage Pancakes)",
          "source": "My Korean Kitchen",
          "url": "https://mykoreankitchen.com/baechujeon/",
          "medium": "blog"
        }
      ]
    },
    "health": {
      "lead": "맛도 포기하지 않는 건강식",
      "items": [
        {
          "title": "Makgeolli (Korean Rice Wine)",
          "source": "My Korean Kitchen",
          "url": "https://mykoreankitchen.com/makgeolli/",
          "medium": "blog"
        }
      ]
    },
    "habit": {
      "lead": "잘 먹는 법에 대한 작은 이야기",
      "items": []
    }
  }
}
